{
  "feed": "2026-10",
  "as_of": "2026-10-23",
  "expires": "2026-11-27",
  "source_digest": "Developer and Infrastructure Security Digest_ Sept 23 to Oct 23, 2026 (v2, verified).md",
  "entries": [
    {
      "id": "PYA-2026-10-001",
      "title": "litellm 1.107.0 malicious release (credential stealer, .pth startup hook)",
      "kind": "package",
      "ecosystem": "PyPI",
      "package": "litellm",
      "aliases": [
        "MAL-2026-2144"
      ],
      "versions": [
        "1.107.0"
      ],
      "fixed_in": [
        "1.106.2"
      ],
      "severity": "CRITICAL",
      "kev": false,
      "malicious": true,
      "confidence": "confirmed",
      "cwe": "CWE-506",
      "attack": "T1546.018",
      "iocs": [
        {
          "type": "filename",
          "value": "cook.pth",
          "note": "startup hook that runs on every Python start"
        },
        {
          "type": "filename",
          "value": "sitecustomize.py",
          "note": "startup hook; legitimate copies exist, confirm content before acting"
        },
        {
          "type": "filename",
          "value": "litellm-1.107.0.dist-info",
          "note": "installed malicious wheel metadata directory"
        },
        {
          "type": "string",
          "value": "/tmp/remote_code_loader.lock",
          "note": "lock file of the hourly remote code loader daemon"
        },
        {
          "type": "regex",
          "value": "litellm\\.dev/healthcheck",
          "note": "exfiltration endpoint litellm[.]dev/healthcheck (defanged)"
        },
        {
          "type": "regex",
          "value": "\\bBerri-AI/litellm\\b",
          "note": "lookalike repository the hijacked release workflow built from (the real org is BerriAI)"
        }
      ],
      "response_order": "litellm-pth",
      "advice": "Do not run pip or python first: delete the .pth and sitecustomize files from the shell, kill the loader daemon, rebuild, then rotate every secret the host could read. Pin 1.106.2 or another release from 1.100.4 to 1.106.2.",
      "digest_ref": "D§11",
      "sources": [
        "https://docs.litellm.ai/blog/security-incident-oct-21-2026",
        "https://www.stepsecurity.io/blog/litellm-1-107-0-compromised-pypi-backdoored-wheels-credential-stealer",
        "https://research.jfrog.com/post/litellm-hijacked-again/",
        "https://osv.dev/vulnerability/MAL-2026-2144"
      ]
    },
    {
      "id": "PYA-2026-10-002",
      "title": "litellm Docker images v1.107.0 (malicious tags)",
      "kind": "image",
      "ecosystem": "Docker",
      "package": "berriai/litellm",
      "aliases": [
        "MAL-2026-2144"
      ],
      "versions": [
        "1.107.0"
      ],
      "severity": "CRITICAL",
      "kev": false,
      "malicious": true,
      "confidence": "confirmed",
      "cwe": "CWE-506",
      "attack": "T1546.018",
      "iocs": [
        {
          "type": "regex",
          "value": "berriai/litellm(?:-database|-non_root)?:v?1\\.107\\.0\\b",
          "note": "Docker Hub or GHCR tag v1.107.0, including litellm-database and litellm-non_root"
        }
      ],
      "response_order": "litellm-pth",
      "advice": "The latest, main-latest and main-stable tags also carried the payload from 11:46 to 14:20 UTC on Oct 21; rebuild from a pinned digest of a clean release.",
      "digest_ref": "D§11",
      "sources": [
        "https://docs.litellm.ai/blog/security-incident-oct-21-2026",
        "https://www.rescana.com/post/litellm-1-107-0-supply-chain-compromise-october-2026",
        "https://www.stepsecurity.io/blog/litellm-1-107-0-compromised-pypi-backdoored-wheels-credential-stealer"
      ]
    },
    {
      "id": "PYA-2026-10-003",
      "title": "litellm proxy privilege escalation to code execution (CVE-2026-114612)",
      "kind": "package",
      "ecosystem": "PyPI",
      "package": "litellm",
      "aliases": [
        "CVE-2026-114612",
        "GHSA-7hp6-4w63-5g45"
      ],
      "ranges": [
        {
          "introduced": "0",
          "fixed": "1.100.4"
        }
      ],
      "fixed_in": [
        "1.100.4",
        "1.101.3",
        "1.102.2",
        "1.103.1"
      ],
      "severity": "CRITICAL",
      "kev": false,
      "malicious": false,
      "confidence": "confirmed",
      "cwe": "CWE-269",
      "advice": "An internal_user can become proxy_admin and run code through the MCP stdio endpoint. Never pin below 1.100.4.",
      "digest_ref": "D§11",
      "sources": [
        "https://github.com/BerriAI/litellm/security/advisories/GHSA-7hp6-4w63-5g45"
      ]
    },
    {
      "id": "PYA-2026-10-004",
      "title": "tensorlake 0.5.144 malicious release with token-gated home directory wiper",
      "kind": "package",
      "ecosystem": "npm",
      "package": "tensorlake",
      "aliases": [
        "GHSA-rqxj-g25x-4v9v",
        "MAL-2026-17650"
      ],
      "versions": [
        "0.5.144"
      ],
      "fixed_in": [
        "0.5.145"
      ],
      "severity": "CRITICAL",
      "kev": false,
      "malicious": true,
      "confidence": "confirmed",
      "cwe": "CWE-506",
      "attack": "T1485",
      "iocs": [
        {
          "type": "regex",
          "value": "\\bgh-token-monitor\\b",
          "note": "persistent token monitor (systemd user service on Linux) that wipes the home directory once the stolen token is revoked"
        },
        {
          "type": "path_glob",
          "value": "**/systemd/user/gh-token-monitor*",
          "note": "systemd user unit of the token monitor"
        }
      ],
      "response_order": "tensorlake-wiper",
      "advice": "Isolate the machine and remove gh-token-monitor and its service before revoking any token, then revoke from a clean machine.",
      "digest_ref": "D§12",
      "sources": [
        "https://checkmarx.com/zero-post/mini-shai-hulud-in-tensorlake-a-token-monitor-that-can-wipe-your-home-directory/",
        "https://stepsecurity.io/blog/tensorlake-npm-compromised-hostage-token-worm",
        "https://github.com/advisories/GHSA-rqxj-g25x-4v9v"
      ]
    },
    {
      "id": "PYA-2026-10-005",
      "title": "@subql/common 5.8.3 compromised release (install hook token stealer)",
      "kind": "package",
      "ecosystem": "npm",
      "package": "@subql/common",
      "versions": [
        "5.8.3"
      ],
      "severity": "CRITICAL",
      "kev": false,
      "malicious": true,
      "confidence": "confirmed",
      "cwe": "CWE-506",
      "attack": "T1195.001",
      "response_order": "rotate-on-exposure",
      "advice": "If it ever installed, rotate GitHub, npm and cloud tokens that machine could read.",
      "digest_ref": "D§12",
      "sources": [
        "https://dev.to/quietkernel/how-npm-worms-steal-your-credentials-and-the-order-to-rotate-them-in-5fd1"
      ]
    },
    {
      "id": "PYA-2026-10-006",
      "title": "@apexacc/cli 1.6.2 repackaged coding agent that hijacks the developer's AI agent (REF8801)",
      "kind": "package",
      "ecosystem": "npm",
      "package": "@apexacc/cli",
      "versions": [
        "1.6.2"
      ],
      "severity": "CRITICAL",
      "kev": false,
      "malicious": true,
      "confidence": "unverified",
      "cwe": "CWE-506",
      "attack": "T1195.001",
      "response_order": "rotate-on-exposure",
      "advice": "Elastic REF8801 was seen only through a secondary source; treat any install as a compromise until checked.",
      "digest_ref": "D§12",
      "sources": [
        "https://safeguard.sh/resources/blog/npm-malware-advisory-fully-compromised-what-the-analysis-says-2026"
      ]
    },
    {
      "id": "PYA-2026-10-007",
      "title": "imgdecode (MALFEX operator) malicious npm package",
      "kind": "package",
      "ecosystem": "npm",
      "package": "imgdecode",
      "ranges": [
        {
          "introduced": "0"
        }
      ],
      "severity": "CRITICAL",
      "kev": false,
      "malicious": true,
      "confidence": "confirmed",
      "cwe": "CWE-506",
      "attack": "T1195.001",
      "response_order": "rotate-on-exposure",
      "advice": "Every version is malicious (Windows shellcode loader, Overlord RAT and a stealer). Remove it and treat the machine as compromised.",
      "digest_ref": "D§12",
      "sources": [
        "https://thehackernews.com/2026/10/malfex-npm-package-imgdecode-hides.html",
        "https://gbhackers.com/npm-supply-chain-campaign/"
      ]
    },
    {
      "id": "PYA-2026-10-008",
      "title": "GhostAction injected workflow exfiltrating secrets",
      "kind": "technique",
      "severity": "CRITICAL",
      "kev": false,
      "malicious": true,
      "confidence": "confirmed",
      "cwe": "CWE-506",
      "attack": "T1041",
      "iocs": [
        {
          "type": "path_glob",
          "value": ".github/workflows/security-audit.y*ml",
          "note": "injected workflow file name used by the campaign; confirm nobody on the team added it"
        },
        {
          "type": "regex",
          "value": "193\\.32\\.204\\.199",
          "note": "exfiltration host 193.32.204[.]199 (defanged)"
        }
      ],
      "response_order": "rotate-on-exposure",
      "advice": "Delete the injected workflow, review the repository's Actions runs, and rotate every secret the workflow could read.",
      "digest_ref": "D§12",
      "sources": [
        "https://blog.gitguardian.com/ghostaction-github-actions-supply-chain-attack-returns/",
        "https://thehackernews.com/2026/10/credential-stealing-github-actions.html"
      ]
    },
    {
      "id": "PYA-2026-10-009",
      "title": "OVHcloud CLI v0.11.0 to v0.15.0 binaries swapped via install.sh",
      "kind": "tool",
      "ecosystem": "Go",
      "package": "github.com/ovh/ovhcloud-cli",
      "ranges": [
        {
          "introduced": "0.11.0",
          "fixed": "0.16.0"
        }
      ],
      "fixed_in": [
        "0.16.0"
      ],
      "severity": "CRITICAL",
      "kev": false,
      "malicious": true,